"No.","Time","Source","Destination","Protocol","Length","Info"
"1","0.000000","51.75.61.78","192.168.1.15","TCP","1506","443  >  63220 [ACK] Seq=1 Ack=1 Win=32 Len=1452"
"2","0.000000","51.75.61.78","192.168.1.15","TCP","1506","[TCP segment of a reassembled PDU]"
"3","0.000000","51.75.61.78","192.168.1.15","TCP","1506","[TCP segment of a reassembled PDU]"
"4","0.000000","51.75.61.78","192.168.1.15","TCP","1506","[TCP segment of a reassembled PDU]"
"5","0.000000","51.75.61.78","192.168.1.15","TCP","1506","[TCP segment of a reassembled PDU]"
"6","0.000000","51.75.61.78","192.168.1.15","TCP","1506","[TCP segment of a reassembled PDU]"
"7","0.000288","192.168.1.15","51.75.61.78","TCP","54","63220  >  443 [ACK] Seq=1 Ack=8713 Win=9347 Len=0"
"8","0.003180","51.75.61.78","192.168.1.15","TCP","1506","[TCP segment of a reassembled PDU]"
"9","0.003180","51.75.61.78","192.168.1.15","TCP","1506","[TCP segment of a reassembled PDU]"
"10","0.003180","51.75.61.78","192.168.1.15","TCP","1506","[TCP segment of a reassembled PDU]"
"11","0.003180","51.75.61.78","192.168.1.15","TCP","1506","[TCP segment of a reassembled PDU]"
"12","0.003180","51.75.61.78","192.168.1.15","TCP","1506","[TCP segment of a reassembled PDU]"
"13","0.003180","51.75.61.78","192.168.1.15","TCP","1506","[TCP segment of a reassembled PDU]"
"14","0.003180","51.75.61.78","192.168.1.15","TCP","1506","[TCP segment of a reassembled PDU]"
"15","0.003180","51.75.61.78","192.168.1.15","TCP","1506","[TCP segment of a reassembled PDU]"
"16","0.003180","51.75.61.78","192.168.1.15","TCP","1506","[TCP segment of a reassembled PDU]"
"17","0.003180","51.75.61.78","192.168.1.15","SSLv2","1506","Encrypted Data"
"18","0.003180","51.75.61.78","192.168.1.15","TCP","1506","[TCP segment of a reassembled PDU]"
"19","0.003180","51.75.61.78","192.168.1.15","TCP","1506","[TCP segment of a reassembled PDU]"
"20","0.003180","51.75.61.78","192.168.1.15","TCP","1506","[TCP segment of a reassembled PDU]"
"21","0.003180","51.75.61.78","192.168.1.15","TCP","1506","[TCP segment of a reassembled PDU]"
"22","0.003180","51.75.61.78","192.168.1.15","TCP","1506","[TCP segment of a reassembled PDU]"
"23","0.003611","192.168.1.15","51.75.61.78","TCP","54","63220  >  443 [ACK] Seq=1 Ack=30493 Win=9347 Len=0"
"24","0.006298","51.75.61.78","192.168.1.15","TCP","1506","[TCP segment of a reassembled PDU]"
"25","0.006298","51.75.61.78","192.168.1.15","TCP","1506","[TCP segment of a reassembled PDU]"
"26","0.006298","51.75.61.78","192.168.1.15","TCP","1506","[TCP segment of a reassembled PDU]"
"27","0.006298","51.75.61.78","192.168.1.15","SSLv2","1506","Encrypted Data"
"28","0.006298","51.75.61.78","192.168.1.15","TCP","1506","[TCP segment of a reassembled PDU]"
"29","0.006298","51.75.61.78","192.168.1.15","TCP","1506","[TCP segment of a reassembled PDU]"
"30","0.006298","51.75.61.78","192.168.1.15","TCP","1506","[TCP segment of a reassembled PDU]"
"31","0.006298","51.75.61.78","192.168.1.15","TCP","1506","[TCP segment of a reassembled PDU]"
"32","0.006298","51.75.61.78","192.168.1.15","TCP","1506","[TCP segment of a reassembled PDU]"
"33","0.006298","51.75.61.78","192.168.1.15","TCP","1506","[TCP segment of a reassembled PDU]"
"34","0.006298","51.75.61.78","192.168.1.15","TCP","1506","[TCP segment of a reassembled PDU]"
"35","0.006298","51.75.61.78","192.168.1.15","TCP","1506","[TCP segment of a reassembled PDU]"
"36","0.006298","51.75.61.78","192.168.1.15","TCP","1506","[TCP segment of a reassembled PDU]"
"37","0.006298","51.75.61.78","192.168.1.15","SSLv2","1506","Encrypted Data"
"38","0.006298","51.75.61.78","192.168.1.15","TCP","1506","[TCP segment of a reassembled PDU]"
"39","0.006742","192.168.1.15","51.75.61.78","TCP","54","63220  >  443 [ACK] Seq=1 Ack=52273 Win=9347 Len=0"
"40","0.006861","51.75.61.78","192.168.1.15","TCP","1506","[TCP segment of a reassembled PDU]"
"41","0.007628","51.75.61.78","192.168.1.15","TCP","1506","[TCP segment of a reassembled PDU]"
"42","0.007628","51.75.61.78","192.168.1.15","TCP","1506","[TCP segment of a reassembled PDU]"
"43","0.007628","51.75.61.78","192.168.1.15","SSLv2","1506","Encrypted Data"
"44","0.007628","51.75.61.78","192.168.1.15","TCP","1506","[TCP segment of a reassembled PDU]"
"45","0.007628","51.75.61.78","192.168.1.15","TCP","1506","[TCP segment of a reassembled PDU]"
"46","0.007628","51.75.61.78","192.168.1.15","TCP","1506","[TCP segment of a reassembled PDU]"
"47","0.007794","192.168.1.15","51.75.61.78","TCP","54","63220  >  443 [ACK] Seq=1 Ack=62437 Win=9347 Len=0"
"48","0.017680","51.75.61.78","192.168.1.15","TCP","1506","[TCP segment of a reassembled PDU]"
"49","0.017680","51.75.61.78","192.168.1.15","TCP","1506","[TCP segment of a reassembled PDU]"
"50","0.017843","192.168.1.15","51.75.61.78","TCP","54","63220  >  443 [ACK] Seq=1 Ack=65341 Win=9347 Len=0"
"51","0.018653","51.75.61.78","192.168.1.15","TCP","1506","[TCP segment of a reassembled PDU]"
"52","0.018653","51.75.61.78","192.168.1.15","TCP","1506","[TCP segment of a reassembled PDU]"
"53","0.018653","51.75.61.78","192.168.1.15","TCP","1506","[TCP segment of a reassembled PDU]"
"54","0.018653","51.75.61.78","192.168.1.15","TCP","1506","[TCP segment of a reassembled PDU]"
"55","0.018835","192.168.1.15","51.75.61.78","TCP","54","63220  >  443 [ACK] Seq=1 Ack=71149 Win=9347 Len=0"
"56","0.020473","51.75.61.78","192.168.1.15","TCP","1506","[TCP segment of a reassembled PDU]"
"57","0.020473","51.75.61.78","192.168.1.15","TCP","1506","[TCP segment of a reassembled PDU]"
"58","0.020473","51.75.61.78","192.168.1.15","TCP","1506","[TCP segment of a reassembled PDU]"
"59","0.020473","51.75.61.78","192.168.1.15","TCP","1506","[TCP segment of a reassembled PDU]"
"60","0.020473","51.75.61.78","192.168.1.15","TCP","1506","[TCP segment of a reassembled PDU]"
"61","0.020473","51.75.61.78","192.168.1.15","TCP","1506","[TCP segment of a reassembled PDU]"
"62","0.020473","51.75.61.78","192.168.1.15","TCP","1506","[TCP segment of a reassembled PDU]"
"63","0.020473","51.75.61.78","192.168.1.15","TCP","1506","[TCP segment of a reassembled PDU]"
"64","0.020761","192.168.1.15","51.75.61.78","TCP","54","63220  >  443 [ACK] Seq=1 Ack=82765 Win=9347 Len=0"
"65","0.030233","51.75.61.78","192.168.1.15","TCP","1506","[TCP segment of a reassembled PDU]"
"66","0.030233","51.75.61.78","192.168.1.15","TCP","1506","[TCP segment of a reassembled PDU]"
"67","0.030233","51.75.61.78","192.168.1.15","TCP","1506","[TCP segment of a reassembled PDU]"
"68","0.030233","51.75.61.78","192.168.1.15","TCP","1506","[TCP segment of a reassembled PDU]"
"69","0.030233","51.75.61.78","192.168.1.15","TCP","1506","[TCP segment of a reassembled PDU]"
"70","0.030233","51.75.61.78","192.168.1.15","TCP","1506","[TCP segment of a reassembled PDU]"
"71","0.030233","51.75.61.78","192.168.1.15","SSLv2","1506","Encrypted Data"
"72","0.030233","51.75.61.78","192.168.1.15","TCP","1506","[TCP segment of a reassembled PDU]"
"73","0.030233","51.75.61.78","192.168.1.15","TCP","1506","[TCP segment of a reassembled PDU]"
"74","0.030657","192.168.1.15","51.75.61.78","TCP","54","63220  >  443 [ACK] Seq=1 Ack=95833 Win=9347 Len=0"
"75","0.032200","51.75.61.78","192.168.1.15","TCP","1506","[TCP segment of a reassembled PDU]"
"76","0.032200","51.75.61.78","192.168.1.15","TCP","1506","[TCP segment of a reassembled PDU]"
"77","0.032200","51.75.61.78","192.168.1.15","TCP","1506","[TCP segment of a reassembled PDU]"
"78","0.032200","51.75.61.78","192.168.1.15","TCP","1506","[TCP segment of a reassembled PDU]"
"79","0.032200","51.75.61.78","192.168.1.15","TCP","1506","[TCP segment of a reassembled PDU]"
"80","0.032200","51.75.61.78","192.168.1.15","TCP","1506","[TCP segment of a reassembled PDU]"
"81","0.032200","51.75.61.78","192.168.1.15","TCP","1506","[TCP segment of a reassembled PDU]"
"82","0.032200","51.75.61.78","192.168.1.15","TCP","1506","[TCP segment of a reassembled PDU]"
"83","0.032200","51.75.61.78","192.168.1.15","TCP","1506","[TCP segment of a reassembled PDU]"
"84","0.032200","51.75.61.78","192.168.1.15","TCP","1506","[TCP segment of a reassembled PDU]"
"85","0.032200","51.75.61.78","192.168.1.15","TCP","1506","[TCP segment of a reassembled PDU]"
"86","0.032200","51.75.61.78","192.168.1.15","TCP","1506","[TCP segment of a reassembled PDU]"
"87","0.032493","192.168.1.15","51.75.61.78","TCP","54","63220  >  443 [ACK] Seq=1 Ack=113257 Win=9347 Len=0"
"88","0.034305","51.75.61.78","192.168.1.15","TCP","1506","[TCP segment of a reassembled PDU]"
"89","0.034305","51.75.61.78","192.168.1.15","TCP","1506","[TCP segment of a reassembled PDU]"
"90","0.034305","51.75.61.78","192.168.1.15","TCP","1506","[TCP segment of a reassembled PDU]"
"91","0.034305","51.75.61.78","192.168.1.15","TCP","1506","[TCP segment of a reassembled PDU]"
"92","0.034305","51.75.61.78","192.168.1.15","TCP","1506","[TCP segment of a reassembled PDU]"
"93","0.034305","51.75.61.78","192.168.1.15","TCP","1506","[TCP segment of a reassembled PDU]"
"94","0.034305","51.75.61.78","192.168.1.15","TCP","1506","[TCP segment of a reassembled PDU]"
"95","0.034305","51.75.61.78","192.168.1.15","TCP","1506","[TCP segment of a reassembled PDU]"
"96","0.034305","51.75.61.78","192.168.1.15","TCP","1506","[TCP segment of a reassembled PDU]"
"97","0.034305","51.75.61.78","192.168.1.15","TCP","1506","[TCP segment of a reassembled PDU]"
"98","0.034600","192.168.1.15","51.75.61.78","TCP","54","63220  >  443 [ACK] Seq=1 Ack=127777 Win=9347 Len=0"
"99","0.282022","51.75.61.78","192.168.1.15","TCP","1506","[TCP segment of a reassembled PDU]"
"100","0.282022","51.75.61.78","192.168.1.15","TCP","1506","[TCP segment of a reassembled PDU]"
"101","0.282022","51.75.61.78","192.168.1.15","TCP","1506","[TCP segment of a reassembled PDU]"
"102","0.282022","51.75.61.78","192.168.1.15","TCP","1506","[TCP segment of a reassembled PDU]"
"103","0.282022","51.75.61.78","192.168.1.15","SSLv2","1506","Encrypted Data"
"104","0.282022","51.75.61.78","192.168.1.15","TCP","1506","[TCP segment of a reassembled PDU]"
"105","0.282022","51.75.61.78","192.168.1.15","TCP","1506","[TCP segment of a reassembled PDU]"
"106","0.282022","51.75.61.78","192.168.1.15","TCP","1506","[TCP segment of a reassembled PDU]"
"107","0.282022","51.75.61.78","192.168.1.15","TCP","1506","[TCP segment of a reassembled PDU]"
"108","0.282022","51.75.61.78","192.168.1.15","TCP","1506","[TCP segment of a reassembled PDU]"
"109","0.282022","51.75.61.78","192.168.1.15","TCP","1506","[TCP segment of a reassembled PDU]"
"110","0.282022","51.75.61.78","192.168.1.15","TCP","1506","[TCP segment of a reassembled PDU]"
"111","0.282022","51.75.61.78","192.168.1.15","TCP","1506","[TCP segment of a reassembled PDU]"
"112","0.282022","51.75.61.78","192.168.1.15","TCP","1506","[TCP segment of a reassembled PDU]"
"113","0.282022","51.75.61.78","192.168.1.15","TCP","1506","[TCP segment of a reassembled PDU]"
"114","0.282722","192.168.1.15","51.75.61.78","TCP","54","63220  >  443 [ACK] Seq=1 Ack=149557 Win=9347 Len=0"
"115","0.282897","51.75.61.78","192.168.1.15","TCP","1506","[TCP segment of a reassembled PDU]"
"116","0.283000","192.168.1.15","51.75.61.78","TCP","54","63220  >  443 [ACK] Seq=1 Ack=151009 Win=9347 Len=0"
"117","0.283155","51.75.61.78","192.168.1.15","TCP","1506","[TCP segment of a reassembled PDU]"
"118","0.283155","51.75.61.78","192.168.1.15","TCP","1506","[TCP segment of a reassembled PDU]"
"119","0.283155","51.75.61.78","192.168.1.15","TCP","1506","[TCP segment of a reassembled PDU]"
"120","0.283155","51.75.61.78","192.168.1.15","TCP","1506","[TCP segment of a reassembled PDU]"
"121","0.283155","51.75.61.78","192.168.1.15","TCP","1506","[TCP segment of a reassembled PDU]"
"122","0.283388","192.168.1.15","51.75.61.78","TCP","54","63220  >  443 [ACK] Seq=1 Ack=158269 Win=9347 Len=0"
"123","0.286138","51.75.61.78","192.168.1.15","TCP","1506","[TCP segment of a reassembled PDU]"
"124","0.286138","51.75.61.78","192.168.1.15","TCP","1506","[TCP segment of a reassembled PDU]"
"125","0.286138","51.75.61.78","192.168.1.15","TCP","1506","[TCP segment of a reassembled PDU]"
"126","0.286138","51.75.61.78","192.168.1.15","TCP","1506","[TCP segment of a reassembled PDU]"
"127","0.286138","51.75.61.78","192.168.1.15","TCP","1506","[TCP segment of a reassembled PDU]"
"128","0.286138","51.75.61.78","192.168.1.15","TCP","1506","[TCP segment of a reassembled PDU]"
"129","0.286138","51.75.61.78","192.168.1.15","TCP","1506","[TCP segment of a reassembled PDU]"
"130","0.286138","51.75.61.78","192.168.1.15","TCP","1506","[TCP segment of a reassembled PDU]"
"131","0.286138","51.75.61.78","192.168.1.15","TCP","1506","[TCP segment of a reassembled PDU]"
"132","0.286138","51.75.61.78","192.168.1.15","TCP","1506","[TCP segment of a reassembled PDU]"
"133","0.286578","192.168.1.15","51.75.61.78","TCP","54","63220  >  443 [ACK] Seq=1 Ack=172789 Win=9347 Len=0"
"134","0.288979","51.75.61.78","192.168.1.15","TCP","1506","[TCP segment of a reassembled PDU]"
"135","0.288979","51.75.61.78","192.168.1.15","TCP","1506","[TCP segment of a reassembled PDU]"
"136","0.288979","51.75.61.78","192.168.1.15","TCP","1506","[TCP segment of a reassembled PDU]"
"137","0.288979","51.75.61.78","192.168.1.15","TCP","1506","[TCP segment of a reassembled PDU]"
"138","0.288979","51.75.61.78","192.168.1.15","SSLv2","1506","Encrypted Data"
"139","0.288979","51.75.61.78","192.168.1.15","TCP","1506","[TCP segment of a reassembled PDU]"
"140","0.288979","51.75.61.78","192.168.1.15","TCP","1506","[TCP segment of a reassembled PDU]"
"141","0.288979","51.75.61.78","192.168.1.15","TCP","1506","[TCP segment of a reassembled PDU]"
"142","0.288979","51.75.61.78","192.168.1.15","TCP","1506","[TCP segment of a reassembled PDU]"
"143","0.288979","51.75.61.78","192.168.1.15","TCP","1506","[TCP segment of a reassembled PDU]"
"144","0.288979","51.75.61.78","192.168.1.15","TCP","1506","[TCP segment of a reassembled PDU]"
"145","0.289453","192.168.1.15","51.75.61.78","TCP","54","63220  >  443 [ACK] Seq=1 Ack=188761 Win=9347 Len=0"
"146","0.289644","51.75.61.78","192.168.1.15","TCP","1506","[TCP segment of a reassembled PDU]"
"147","0.289644","51.75.61.78","192.168.1.15","TCP","1506","[TCP segment of a reassembled PDU]"
"148","0.289644","51.75.61.78","192.168.1.15","TCP","1506","[TCP segment of a reassembled PDU]"
"149","0.289644","51.75.61.78","192.168.1.15","TCP","1506","[TCP segment of a reassembled PDU]"
"150","0.289644","51.75.61.78","192.168.1.15","TCP","1506","[TCP segment of a reassembled PDU]"
"151","0.289644","51.75.61.78","192.168.1.15","TCP","1506","[TCP segment of a reassembled PDU]"
"152","0.289644","51.75.61.78","192.168.1.15","TCP","1506","[TCP segment of a reassembled PDU]"
"153","0.289961","192.168.1.15","51.75.61.78","TCP","54","63220  >  443 [ACK] Seq=1 Ack=198925 Win=9347 Len=0"
"154","0.294343","51.75.61.78","192.168.1.15","TCP","1506","[TCP segment of a reassembled PDU]"
"155","0.294343","51.75.61.78","192.168.1.15","TCP","1506","[TCP segment of a reassembled PDU]"
"156","0.294343","51.75.61.78","192.168.1.15","TCP","1506","[TCP segment of a reassembled PDU]"
"157","0.294343","51.75.61.78","192.168.1.15","SSLv2","1506","Encrypted Data"
"158","0.294343","51.75.61.78","192.168.1.15","TCP","1506","[TCP segment of a reassembled PDU]"
"159","0.294343","51.75.61.78","192.168.1.15","TCP","1506","[TCP segment of a reassembled PDU]"
"160","0.294558","192.168.1.15","51.75.61.78","TCP","54","63220  >  443 [ACK] Seq=1 Ack=207637 Win=9347 Len=0"
"161","0.295944","51.75.61.78","192.168.1.15","SSLv2","1506","Encrypted Data"
"162","0.295944","51.75.61.78","192.168.1.15","TCP","1506","[TCP segment of a reassembled PDU]"
"163","0.296032","192.168.1.15","51.75.61.78","TCP","54","63220  >  443 [ACK] Seq=1 Ack=210541 Win=9347 Len=0"
"164","0.297030","51.75.61.78","192.168.1.15","TCP","1506","[TCP segment of a reassembled PDU]"
"165","0.297097","192.168.1.15","51.75.61.78","TCP","54","63220  >  443 [ACK] Seq=1 Ack=211993 Win=9347 Len=0"
"166","0.297169","51.75.61.78","192.168.1.15","TCP","1506","[TCP segment of a reassembled PDU]"
"167","0.297812","51.75.61.78","192.168.1.15","TCP","1506","[TCP segment of a reassembled PDU]"
"168","0.297812","51.75.61.78","192.168.1.15","TCP","1506","[TCP segment of a reassembled PDU]"
"169","0.297907","192.168.1.15","51.75.61.78","TCP","54","63220  >  443 [ACK] Seq=1 Ack=216349 Win=9347 Len=0"
"170","0.297989","51.75.61.78","192.168.1.15","TCP","1506","[TCP segment of a reassembled PDU]"
"171","0.297989","51.75.61.78","192.168.1.15","SSLv2","1506","Encrypted Data"
"172","0.298064","192.168.1.15","51.75.61.78","TCP","54","63220  >  443 [ACK] Seq=1 Ack=219253 Win=9347 Len=0"
"173","0.305333","51.75.61.78","192.168.1.15","TCP","1506","[TCP segment of a reassembled PDU]"
"174","0.305333","51.75.61.78","192.168.1.15","TCP","1506","[TCP segment of a reassembled PDU]"
"175","0.305333","51.75.61.78","192.168.1.15","TCP","1506","[TCP segment of a reassembled PDU]"
"176","0.305333","51.75.61.78","192.168.1.15","TCP","1506","[TCP segment of a reassembled PDU]"
"177","0.305333","51.75.61.78","192.168.1.15","TCP","1506","[TCP segment of a reassembled PDU]"
"178","0.305333","51.75.61.78","192.168.1.15","TCP","1506","[TCP segment of a reassembled PDU]"
"179","0.305333","51.75.61.78","192.168.1.15","TCP","1506","[TCP segment of a reassembled PDU]"
"180","0.305333","51.75.61.78","192.168.1.15","TCP","1506","[TCP segment of a reassembled PDU]"
"181","0.305333","51.75.61.78","192.168.1.15","TCP","1506","[TCP segment of a reassembled PDU]"
"182","0.305811","192.168.1.15","51.75.61.78","TCP","54","63220  >  443 [ACK] Seq=1 Ack=232321 Win=9347 Len=0"
"183","0.308363","51.75.61.78","192.168.1.15","TCP","1506","[TCP segment of a reassembled PDU]"
"184","0.308363","51.75.61.78","192.168.1.15","TCP","1506","[TCP segment of a reassembled PDU]"
"185","0.308363","51.75.61.78","192.168.1.15","TCP","1506","[TCP segment of a reassembled PDU]"
"186","0.308363","51.75.61.78","192.168.1.15","SSLv2","1506","Encrypted Data"
"187","0.308363","51.75.61.78","192.168.1.15","TCP","1506","443  >  63220 [ACK] Seq=238129 Ack=1 Win=32 Len=1452"
"188","0.308363","51.75.61.78","192.168.1.15","TCP","1506","[TCP segment of a reassembled PDU]"
"189","0.308363","51.75.61.78","192.168.1.15","TCP","1506","[TCP segment of a reassembled PDU]"
"190","0.308363","51.75.61.78","192.168.1.15","TCP","1506","[TCP segment of a reassembled PDU]"
"191","0.308363","51.75.61.78","192.168.1.15","TCP","1506","[TCP segment of a reassembled PDU]"
"192","0.308363","51.75.61.78","192.168.1.15","TCP","1506","[TCP segment of a reassembled PDU]"
"193","0.308363","51.75.61.78","192.168.1.15","TCP","1506","443  >  63220 [ACK] Seq=246841 Ack=1 Win=32 Len=1452 [TCP segment of a reassembled PDU]"
"194","0.308363","51.75.61.78","192.168.1.15","TCP","1506","443  >  63220 [ACK] Seq=248293 Ack=1 Win=32 Len=1452 [TCP segment of a reassembled PDU]"
"195","0.308363","51.75.61.78","192.168.1.15","TCP","1506","443  >  63220 [ACK] Seq=249745 Ack=1 Win=32 Len=1452 [TCP segment of a reassembled PDU]"
"196","0.308363","51.75.61.78","192.168.1.15","TCP","1506","443  >  63220 [ACK] Seq=251197 Ack=1 Win=32 Len=1452 [TCP segment of a reassembled PDU]"
"197","0.308363","51.75.61.78","192.168.1.15","TCP","1506","443  >  63220 [ACK] Seq=252649 Ack=1 Win=32 Len=1452 [TCP segment of a reassembled PDU]"
"198","0.308967","192.168.1.15","51.75.61.78","TCP","54","63220  >  443 [ACK] Seq=1 Ack=254101 Win=9347 Len=0"
"199","0.309101","51.75.61.78","192.168.1.15","TCP","1506","443  >  63220 [ACK] Seq=254101 Ack=1 Win=32 Len=1452 [TCP segment of a reassembled PDU]"
"200","0.309185","192.168.1.15","51.75.61.78","TCP","54","63220  >  443 [ACK] Seq=1 Ack=255553 Win=9347 Len=0"
"201","0.309309","51.75.61.78","192.168.1.15","TCP","1506","443  >  63220 [ACK] Seq=255553 Ack=1 Win=32 Len=1452 [TCP segment of a reassembled PDU]"
"202","0.309309","51.75.61.78","192.168.1.15","TCP","1506","443  >  63220 [ACK] Seq=257005 Ack=1 Win=32 Len=1452 [TCP segment of a reassembled PDU]"
"203","0.309309","51.75.61.78","192.168.1.15","TCP","1506","443  >  63220 [ACK] Seq=258457 Ack=1 Win=32 Len=1452 [TCP segment of a reassembled PDU]"
"204","0.309309","51.75.61.78","192.168.1.15","TCP","1506","443  >  63220 [ACK] Seq=259909 Ack=1 Win=32 Len=1452 [TCP segment of a reassembled PDU]"
"205","0.309309","51.75.61.78","192.168.1.15","TCP","1506","443  >  63220 [ACK] Seq=261361 Ack=1 Win=32 Len=1452 [TCP segment of a reassembled PDU]"
"206","0.309478","192.168.1.15","51.75.61.78","TCP","54","63220  >  443 [ACK] Seq=1 Ack=262813 Win=9347 Len=0"
"207","0.309679","51.75.61.78","192.168.1.15","SSLv2","1506","Encrypted Data [TCP segment of a reassembled PDU]"
"208","0.309679","51.75.61.78","192.168.1.15","TCP","1506","443  >  63220 [ACK] Seq=264265 Ack=1 Win=32 Len=1452 [TCP segment of a reassembled PDU]"
"209","0.309679","51.75.61.78","192.168.1.15","TCP","1506","443  >  63220 [ACK] Seq=265717 Ack=1 Win=32 Len=1452 [TCP segment of a reassembled PDU]"
"210","0.309783","192.168.1.15","51.75.61.78","TCP","54","63220  >  443 [ACK] Seq=1 Ack=267169 Win=9347 Len=0"
"211","0.476002","zte_81:5b:fa","Broadcast","ARP","42","Who has 192.168.1.5? Tell 192.168.1.1"
"212","0.560673","51.75.61.78","192.168.1.15","TCP","1506","443  >  63220 [ACK] Seq=267169 Ack=1 Win=32 Len=1452 [TCP segment of a reassembled PDU]"
"213","0.560673","51.75.61.78","192.168.1.15","TCP","1506","443  >  63220 [ACK] Seq=268621 Ack=1 Win=32 Len=1452 [TCP segment of a reassembled PDU]"
"214","0.560673","51.75.61.78","192.168.1.15","TCP","1506","443  >  63220 [ACK] Seq=270073 Ack=1 Win=32 Len=1452 [TCP segment of a reassembled PDU]"
"215","0.560673","51.75.61.78","192.168.1.15","TCP","1506","443  >  63220 [ACK] Seq=271525 Ack=1 Win=32 Len=1452 [TCP segment of a reassembled PDU]"
"216","0.560673","51.75.61.78","192.168.1.15","TCP","1506","443  >  63220 [ACK] Seq=272977 Ack=1 Win=32 Len=1452 [TCP segment of a reassembled PDU]"
"217","0.560673","51.75.61.78","192.168.1.15","TCP","1506","443  >  63220 [ACK] Seq=274429 Ack=1 Win=32 Len=1452 [TCP segment of a reassembled PDU]"
"218","0.560673","51.75.61.78","192.168.1.15","SSLv2","1506","Encrypted Data [TCP segment of a reassembled PDU]"
"219","0.560673","51.75.61.78","192.168.1.15","SSLv2","1506","Encrypted Data"
"220","0.560673","51.75.61.78","192.168.1.15","TCP","1506","443  >  63220 [ACK] Seq=278785 Ack=1 Win=32 Len=1452 [TCP segment of a reassembled PDU]"
"221","0.560673","51.75.61.78","192.168.1.15","TCP","1506","443  >  63220 [ACK] Seq=280237 Ack=1 Win=32 Len=1452 [TCP segment of a reassembled PDU]"
"222","0.560673","51.75.61.78","192.168.1.15","TCP","1506","443  >  63220 [ACK] Seq=281689 Ack=1 Win=32 Len=1452 [TCP segment of a reassembled PDU]"
"223","0.560673","51.75.61.78","192.168.1.15","TCP","1506","443  >  63220 [ACK] Seq=283141 Ack=1 Win=32 Len=1452 [TCP segment of a reassembled PDU]"
"224","0.560673","51.75.61.78","192.168.1.15","TCP","1506","443  >  63220 [ACK] Seq=284593 Ack=1 Win=32 Len=1452 [TCP segment of a reassembled PDU]"
"225","0.560673","51.75.61.78","192.168.1.15","TCP","1506","443  >  63220 [ACK] Seq=286045 Ack=1 Win=32 Len=1452 [TCP segment of a reassembled PDU]"
"226","0.560673","51.75.61.78","192.168.1.15","TCP","1506","443  >  63220 [ACK] Seq=287497 Ack=1 Win=32 Len=1452 [TCP segment of a reassembled PDU]"
"227","0.561359","192.168.1.15","51.75.61.78","TCP","54","63220  >  443 [ACK] Seq=1 Ack=288949 Win=9347 Len=0"
"228","0.561537","51.75.61.78","192.168.1.15","TCP","1506","443  >  63220 [ACK] Seq=288949 Ack=1 Win=32 Len=1452 [TCP segment of a reassembled PDU]"
"229","0.561641","192.168.1.15","51.75.61.78","TCP","54","63220  >  443 [ACK] Seq=1 Ack=290401 Win=9347 Len=0"
"230","0.561795","51.75.61.78","192.168.1.15","TCP","1506","443  >  63220 [ACK] Seq=290401 Ack=1 Win=32 Len=1452 [TCP segment of a reassembled PDU]"
"231","0.561795","51.75.61.78","192.168.1.15","TCP","1506","443  >  63220 [ACK] Seq=291853 Ack=1 Win=32 Len=1452 [TCP segment of a reassembled PDU]"
"232","0.561795","51.75.61.78","192.168.1.15","SSLv2","1506","Encrypted Data [TCP segment of a reassembled PDU]"
"233","0.561795","51.75.61.78","192.168.1.15","TCP","1506","443  >  63220 [ACK] Seq=294757 Ack=1 Win=32 Len=1452 [TCP segment of a reassembled PDU]"
"234","0.561795","51.75.61.78","192.168.1.15","TCP","1506","443  >  63220 [ACK] Seq=296209 Ack=1 Win=32 Len=1452 [TCP segment of a reassembled PDU]"
"235","0.562027","192.168.1.15","51.75.61.78","TCP","54","63220  >  443 [ACK] Seq=1 Ack=297661 Win=9347 Len=0"
"236","0.564852","51.75.61.78","192.168.1.15","TCP","1506","443  >  63220 [ACK] Seq=297661 Ack=1 Win=32 Len=1452 [TCP segment of a reassembled PDU]"
"237","0.564852","51.75.61.78","192.168.1.15","TCP","1506","443  >  63220 [ACK] Seq=299113 Ack=1 Win=32 Len=1452 [TCP segment of a reassembled PDU]"
"238","0.564852","51.75.61.78","192.168.1.15","TCP","1506","443  >  63220 [ACK] Seq=300565 Ack=1 Win=32 Len=1452 [TCP segment of a reassembled PDU]"
"239","0.564852","51.75.61.78","192.168.1.15","SSLv2","1506","Encrypted Data [TCP segment of a reassembled PDU]"
"240","0.564852","51.75.61.78","192.168.1.15","TCP","1506","443  >  63220 [ACK] Seq=303469 Ack=1 Win=32 Len=1452 [TCP segment of a reassembled PDU]"
"241","0.564852","51.75.61.78","192.168.1.15","TCP","1506","443  >  63220 [ACK] Seq=304921 Ack=1 Win=32 Len=1452 [TCP segment of a reassembled PDU]"
"242","0.564852","51.75.61.78","192.168.1.15","TCP","1506","443  >  63220 [ACK] Seq=306373 Ack=1 Win=32 Len=1452 [TCP segment of a reassembled PDU]"
"243","0.564852","51.75.61.78","192.168.1.15","TCP","1506","443  >  63220 [ACK] Seq=307825 Ack=1 Win=32 Len=1452 [TCP segment of a reassembled PDU]"
"244","0.564852","51.75.61.78","192.168.1.15","SSLv2","1506","Encrypted Data [TCP segment of a reassembled PDU]"
"245","0.564852","51.75.61.78","192.168.1.15","TCP","1506","443  >  63220 [ACK] Seq=310729 Ack=1 Win=32 Len=1452 [TCP segment of a reassembled PDU]"
"246","0.564852","51.75.61.78","192.168.1.15","TCP","1506","443  >  63220 [ACK] Seq=312181 Ack=1 Win=32 Len=1452 [TCP segment of a reassembled PDU]"
"247","0.564852","51.75.61.78","192.168.1.15","TCP","1506","443  >  63220 [ACK] Seq=313633 Ack=1 Win=32 Len=1452 [TCP segment of a reassembled PDU]"
"248","0.564852","51.75.61.78","192.168.1.15","TCP","1506","443  >  63220 [ACK] Seq=315085 Ack=1 Win=32 Len=1452 [TCP segment of a reassembled PDU]"
"249","0.564852","51.75.61.78","192.168.1.15","TCP","1506","443  >  63220 [ACK] Seq=316537 Ack=1 Win=32 Len=1452 [TCP segment of a reassembled PDU]"
"250","0.564852","51.75.61.78","192.168.1.15","TCP","1506","443  >  63220 [ACK] Seq=317989 Ack=1 Win=32 Len=1452 [TCP segment of a reassembled PDU]"
"251","0.565445","192.168.1.15","51.75.61.78","TCP","54","63220  >  443 [ACK] Seq=1 Ack=319441 Win=9347 Len=0"
"252","0.565603","51.75.61.78","192.168.1.15","TCP","1506","443  >  63220 [ACK] Seq=319441 Ack=1 Win=32 Len=1452 [TCP segment of a reassembled PDU]"
"253","0.565781","51.75.61.78","192.168.1.15","TCP","1506","443  >  63220 [ACK] Seq=320893 Ack=1 Win=32 Len=1452 [TCP segment of a reassembled PDU]"
"254","0.565781","51.75.61.78","192.168.1.15","TCP","1506","443  >  63220 [ACK] Seq=322345 Ack=1 Win=32 Len=1452 [TCP segment of a reassembled PDU]"
"255","0.565781","51.75.61.78","192.168.1.15","TCP","1506","443  >  63220 [ACK] Seq=323797 Ack=1 Win=32 Len=1452 [TCP segment of a reassembled PDU]"
"256","0.565781","51.75.61.78","192.168.1.15","TCP","1506","443  >  63220 [ACK] Seq=325249 Ack=1 Win=32 Len=1452 [TCP segment of a reassembled PDU]"
"257","0.565781","51.75.61.78","192.168.1.15","TCP","1506","443  >  63220 [ACK] Seq=326701 Ack=1 Win=32 Len=1452 [TCP segment of a reassembled PDU]"
"258","0.566024","192.168.1.15","51.75.61.78","TCP","54","63220  >  443 [ACK] Seq=1 Ack=328153 Win=9347 Len=0"
"259","0.567603","51.75.61.78","192.168.1.15","TCP","1506","443  >  63220 [PSH, ACK] Seq=328153 Ack=1 Win=32 Len=1452 [TCP segment of a reassembled PDU]"
"260","0.567603","51.75.61.78","192.168.1.15","TCP","1506","443  >  63220 [ACK] Seq=329605 Ack=1 Win=32 Len=1452 [TCP segment of a reassembled PDU]"
"261","0.567603","51.75.61.78","192.168.1.15","SSLv2","1506","Encrypted Data [TCP segment of a reassembled PDU]"
"262","0.567603","51.75.61.78","192.168.1.15","TCP","1506","443  >  63220 [ACK] Seq=332509 Ack=1 Win=32 Len=1452 [TCP segment of a reassembled PDU]"
"263","0.567603","51.75.61.78","192.168.1.15","TCP","1506","443  >  63220 [ACK] Seq=333961 Ack=1 Win=32 Len=1452 [TCP segment of a reassembled PDU]"
"264","0.567603","51.75.61.78","192.168.1.15","TCP","1506","443  >  63220 [ACK] Seq=335413 Ack=1 Win=32 Len=1452 [TCP segment of a reassembled PDU]"
"265","0.567603","51.75.61.78","192.168.1.15","TCP","1506","443  >  63220 [ACK] Seq=336865 Ack=1 Win=32 Len=1452 [TCP segment of a reassembled PDU]"
"266","0.567603","51.75.61.78","192.168.1.15","TCP","1506","443  >  63220 [ACK] Seq=338317 Ack=1 Win=32 Len=1452 [TCP segment of a reassembled PDU]"
"267","0.567962","192.168.1.15","51.75.61.78","TCP","54","63220  >  443 [ACK] Seq=1 Ack=339769 Win=9347 Len=0"
"268","0.570848","51.75.61.78","192.168.1.15","TCP","1506","443  >  63220 [ACK] Seq=339769 Ack=1 Win=32 Len=1452 [TCP segment of a reassembled PDU]"
"269","0.570848","51.75.61.78","192.168.1.15","SSLv2","1506","Encrypted Data [TCP segment of a reassembled PDU]"
"270","0.570848","51.75.61.78","192.168.1.15","SSLv2","1506","Encrypted Data [TCP segment of a reassembled PDU]"
"271","0.570848","51.75.61.78","192.168.1.15","TCP","1506","443  >  63220 [ACK] Seq=344125 Ack=1 Win=32 Len=1452 [TCP segment of a reassembled PDU]"
"272","0.570848","51.75.61.78","192.168.1.15","TCP","1506","443  >  63220 [ACK] Seq=345577 Ack=1 Win=32 Len=1452 [TCP segment of a reassembled PDU]"
"273","0.570848","51.75.61.78","192.168.1.15","TCP","1506","443  >  63220 [ACK] Seq=347029 Ack=1 Win=32 Len=1452 [TCP segment of a reassembled PDU]"
"274","0.570848","51.75.61.78","192.168.1.15","SSLv2","1506","Encrypted Data [TCP segment of a reassembled PDU]"
"275","0.570848","51.75.61.78","192.168.1.15","TCP","1506","443  >  63220 [ACK] Seq=349933 Ack=1 Win=32 Len=1452 [TCP segment of a reassembled PDU]"
"276","0.570848","51.75.61.78","192.168.1.15","TCP","1506","443  >  63220 [ACK] Seq=351385 Ack=1 Win=32 Len=1452 [TCP segment of a reassembled PDU]"
"277","0.570848","51.75.61.78","192.168.1.15","TCP","1506","443  >  63220 [ACK] Seq=352837 Ack=1 Win=32 Len=1452 [TCP segment of a reassembled PDU]"
"278","0.570848","51.75.61.78","192.168.1.15","TCP","1506","443  >  63220 [ACK] Seq=354289 Ack=1 Win=32 Len=1452 [TCP segment of a reassembled PDU]"
"279","0.570848","51.75.61.78","192.168.1.15","TCP","1506","443  >  63220 [ACK] Seq=355741 Ack=1 Win=32 Len=1452 [TCP segment of a reassembled PDU]"
"280","0.570848","51.75.61.78","192.168.1.15","TCP","1506","443  >  63220 [ACK] Seq=357193 Ack=1 Win=32 Len=1452 [TCP segment of a reassembled PDU]"
"281","0.570848","51.75.61.78","192.168.1.15","SSLv2","1506","Encrypted Data [TCP segment of a reassembled PDU]"
"282","0.570848","51.75.61.78","192.168.1.15","TCP","1506","443  >  63220 [ACK] Seq=360097 Ack=1 Win=32 Len=1452 [TCP segment of a reassembled PDU]"
"283","0.571603","192.168.1.15","51.75.61.78","TCP","54","63220  >  443 [ACK] Seq=1 Ack=361549 Win=9347 Len=0"
"284","0.571795","51.75.61.78","192.168.1.15","TCP","1506","443  >  63220 [ACK] Seq=361549 Ack=1 Win=32 Len=1452 [TCP segment of a reassembled PDU]"
"285","0.571898","192.168.1.15","51.75.61.78","TCP","54","63220  >  443 [ACK] Seq=1 Ack=363001 Win=9347 Len=0"
"286","0.572007","51.75.61.78","192.168.1.15","TCP","1506","443  >  63220 [ACK] Seq=363001 Ack=1 Win=32 Len=1452 [TCP segment of a reassembled PDU]"
"287","0.572135","51.75.61.78","192.168.1.15","TCP","1506","443  >  63220 [ACK] Seq=364453 Ack=1 Win=32 Len=1452 [TCP segment of a reassembled PDU]"
"288","0.572135","51.75.61.78","192.168.1.15","SSLv2","1506","Encrypted Data [TCP segment of a reassembled PDU]"
"289","0.572274","192.168.1.15","51.75.61.78","TCP","54","63220  >  443 [ACK] Seq=1 Ack=367357 Win=9347 Len=0"
"290","0.575086","51.75.61.78","192.168.1.15","TCP","1506","443  >  63220 [ACK] Seq=367357 Ack=1 Win=32 Len=1452 [TCP segment of a reassembled PDU]"
"291","0.575266","192.168.1.15","51.75.61.78","TCP","54","63220  >  443 [ACK] Seq=1 Ack=368809 Win=9347 Len=0"
"292","0.579082","51.75.61.78","192.168.1.15","TCP","1506","443  >  63220 [ACK] Seq=368809 Ack=1 Win=32 Len=1452 [TCP segment of a reassembled PDU]"
"293","0.579082","51.75.61.78","192.168.1.15","TCP","1506","443  >  63220 [ACK] Seq=370261 Ack=1 Win=32 Len=1452 [TCP segment of a reassembled PDU]"
"294","0.579082","51.75.61.78","192.168.1.15","TCP","1506","443  >  63220 [ACK] Seq=371713 Ack=1 Win=32 Len=1452 [TCP segment of a reassembled PDU]"
"295","0.579082","51.75.61.78","192.168.1.15","TCP","1506","443  >  63220 [ACK] Seq=373165 Ack=1 Win=32 Len=1452 [TCP segment of a reassembled PDU]"
"296","0.579082","51.75.61.78","192.168.1.15","TCP","1506","443  >  63220 [ACK] Seq=374617 Ack=1 Win=32 Len=1452 [TCP segment of a reassembled PDU]"
"297","0.579082","51.75.61.78","192.168.1.15","TCP","1506","443  >  63220 [ACK] Seq=376069 Ack=1 Win=32 Len=1452 [TCP segment of a reassembled PDU]"
"298","0.579082","51.75.61.78","192.168.1.15","TCP","1506","443  >  63220 [ACK] Seq=377521 Ack=1 Win=32 Len=1452 [TCP segment of a reassembled PDU]"
"299","0.579379","192.168.1.15","51.75.61.78","TCP","54","63220  >  443 [ACK] Seq=1 Ack=378973 Win=9347 Len=0"
"300","0.579763","51.75.61.78","192.168.1.15","TCP","1506","443  >  63220 [ACK] Seq=378973 Ack=1 Win=32 Len=1452 [TCP segment of a reassembled PDU]"
"301","0.579763","51.75.61.78","192.168.1.15","TCP","1506","443  >  63220 [ACK] Seq=380425 Ack=1 Win=32 Len=1452 [TCP segment of a reassembled PDU]"
"302","0.579763","51.75.61.78","192.168.1.15","SSLv2","1506","Encrypted Data [TCP segment of a reassembled PDU]"
"303","0.579916","192.168.1.15","51.75.61.78","TCP","54","63220  >  443 [ACK] Seq=1 Ack=383329 Win=9347 Len=0"
"304","0.583048","51.75.61.78","192.168.1.15","TCP","1506","443  >  63220 [ACK] Seq=383329 Ack=1 Win=32 Len=1452 [TCP segment of a reassembled PDU]"
"305","0.583048","51.75.61.78","192.168.1.15","TCP","1506","443  >  63220 [ACK] Seq=384781 Ack=1 Win=32 Len=1452 [TCP segment of a reassembled PDU]"
"306","0.583048","51.75.61.78","192.168.1.15","TCP","1506","443  >  63220 [ACK] Seq=386233 Ack=1 Win=32 Len=1452 [TCP segment of a reassembled PDU]"
"307","0.583048","51.75.61.78","192.168.1.15","SSLv2","1506","Encrypted Data [TCP segment of a reassembled PDU]"
"308","0.583048","51.75.61.78","192.168.1.15","TCP","1506","443  >  63220 [ACK] Seq=389137 Ack=1 Win=32 Len=1452 [TCP segment of a reassembled PDU]"
"309","0.583048","51.75.61.78","192.168.1.15","TCP","1506","443  >  63220 [ACK] Seq=390589 Ack=1 Win=32 Len=1452 [TCP segment of a reassembled PDU]"
"310","0.583048","51.75.61.78","192.168.1.15","TCP","1506","443  >  63220 [ACK] Seq=392041 Ack=1 Win=32 Len=1452 [TCP segment of a reassembled PDU]"
"311","0.583048","51.75.61.78","192.168.1.15","TCP","1506","443  >  63220 [ACK] Seq=393493 Ack=1 Win=32 Len=1452 [TCP segment of a reassembled PDU]"
"312","0.583048","51.75.61.78","192.168.1.15","TCP","1506","443  >  63220 [ACK] Seq=394945 Ack=1 Win=32 Len=1452 [TCP segment of a reassembled PDU]"
"313","0.583048","51.75.61.78","192.168.1.15","TCP","1506","443  >  63220 [ACK] Seq=396397 Ack=1 Win=32 Len=1452 [TCP segment of a reassembled PDU]"
"314","0.583048","51.75.61.78","192.168.1.15","TCP","1506","443  >  63220 [ACK] Seq=397849 Ack=1 Win=32 Len=1452 [TCP segment of a reassembled PDU]"
"315","0.583048","51.75.61.78","192.168.1.15","TCP","1506","443  >  63220 [ACK] Seq=399301 Ack=1 Win=32 Len=1452 [TCP segment of a reassembled PDU]"
"316","0.583048","51.75.61.78","192.168.1.15","SSLv2","1506","Encrypted Data [TCP segment of a reassembled PDU]"
"317","0.583048","51.75.61.78","192.168.1.15","TCP","1506","443  >  63220 [ACK] Seq=402205 Ack=1 Win=32 Len=1452 [TCP segment of a reassembled PDU]"
"318","0.583048","51.75.61.78","192.168.1.15","TCP","1506","443  >  63220 [ACK] Seq=403657 Ack=1 Win=32 Len=1452 [TCP segment of a reassembled PDU]"
"319","0.583529","192.168.1.15","51.75.61.78","TCP","54","63220  >  443 [ACK] Seq=1 Ack=405109 Win=9347 Len=0"
"320","0.583694","51.75.61.78","192.168.1.15","TCP","1506","443  >  63220 [ACK] Seq=405109 Ack=1 Win=32 Len=1452 [TCP segment of a reassembled PDU]"
"321","0.583775","192.168.1.15","51.75.61.78","TCP","54","63220  >  443 [ACK] Seq=1 Ack=406561 Win=9347 Len=0"
"322","0.583867","51.75.61.78","192.168.1.15","TCP","1506","443  >  63220 [ACK] Seq=406561 Ack=1 Win=32 Len=1452 [TCP segment of a reassembled PDU]"
"323","0.583867","51.75.61.78","192.168.1.15","TCP","1506","443  >  63220 [ACK] Seq=408013 Ack=1 Win=32 Len=1452 [TCP segment of a reassembled PDU]"
"324","0.583867","51.75.61.78","192.168.1.15","SSLv2","1506","Encrypted Data [TCP segment of a reassembled PDU]"
"325","0.584001","192.168.1.15","51.75.61.78","TCP","54","63220  >  443 [ACK] Seq=1 Ack=410917 Win=9347 Len=0"
"326","0.585034","51.75.61.78","192.168.1.15","TCP","1506","443  >  63220 [ACK] Seq=410917 Ack=1 Win=32 Len=1452 [TCP segment of a reassembled PDU]"
"327","0.585034","51.75.61.78","192.168.1.15","TCP","1506","443  >  63220 [ACK] Seq=412369 Ack=1 Win=32 Len=1452 [TCP segment of a reassembled PDU]"
"328","0.585034","51.75.61.78","192.168.1.15","TCP","1506","443  >  63220 [ACK] Seq=413821 Ack=1 Win=32 Len=1452 [TCP segment of a reassembled PDU]"
"329","0.585034","51.75.61.78","192.168.1.15","TCP","1506","443  >  63220 [ACK] Seq=415273 Ack=1 Win=32 Len=1452 [TCP segment of a reassembled PDU]"
"330","0.585034","51.75.61.78","192.168.1.15","TCP","1506","443  >  63220 [ACK] Seq=416725 Ack=1 Win=32 Len=1452 [TCP segment of a reassembled PDU]"
"331","0.585034","51.75.61.78","192.168.1.15","TCP","1506","443  >  63220 [ACK] Seq=418177 Ack=1 Win=32 Len=1452 [TCP segment of a reassembled PDU]"
"332","0.585310","192.168.1.15","51.75.61.78","TCP","54","63220  >  443 [ACK] Seq=1 Ack=419629 Win=9347 Len=0"
"333","0.843022","51.75.61.78","192.168.1.15","TCP","1506","443  >  63220 [ACK] Seq=419629 Ack=1 Win=32 Len=1452 [TCP segment of a reassembled PDU]"
"334","0.843022","51.75.61.78","192.168.1.15","TCP","1506","443  >  63220 [ACK] Seq=421081 Ack=1 Win=32 Len=1452 [TCP segment of a reassembled PDU]"
"335","0.843022","51.75.61.78","192.168.1.15","TCP","1506","443  >  63220 [ACK] Seq=422533 Ack=1 Win=32 Len=1452 [TCP segment of a reassembled PDU]"
"336","0.843298","192.168.1.15","51.75.61.78","TCP","54","63220  >  443 [ACK] Seq=1 Ack=423985 Win=9347 Len=0"
"337","0.845565","51.75.61.78","192.168.1.15","TCP","1506","443  >  63220 [ACK] Seq=423985 Ack=1 Win=32 Len=1452 [TCP segment of a reassembled PDU]"
"338","0.845565","51.75.61.78","192.168.1.15","TCP","1506","443  >  63220 [ACK] Seq=425437 Ack=1 Win=32 Len=1452 [TCP segment of a reassembled PDU]"
"339","0.845565","51.75.61.78","192.168.1.15","TCP","1506","443  >  63220 [ACK] Seq=426889 Ack=1 Win=32 Len=1452 [TCP segment of a reassembled PDU]"
"340","0.845565","51.75.61.78","192.168.1.15","TCP","1506","443  >  63220 [ACK] Seq=428341 Ack=1 Win=32 Len=1452 [TCP segment of a reassembled PDU]"
"341","0.845565","51.75.61.78","192.168.1.15","TCP","1506","443  >  63220 [ACK] Seq=429793 Ack=1 Win=32 Len=1452 [TCP segment of a reassembled PDU]"
"342","0.845565","51.75.61.78","192.168.1.15","TCP","1506","443  >  63220 [ACK] Seq=431245 Ack=1 Win=32 Len=1452 [TCP segment of a reassembled PDU]"
"343","0.845565","51.75.61.78","192.168.1.15","SSLv2","1506","Encrypted Data [TCP segment of a reassembled PDU]"
